{
  "schema_version": "1.0.0",
  "id": "HM-DEFECT-EVENT-COUNT-SLOW-UPDATE-V01",
  "source": {
    "baseline_commit": "9b731b7f92700227de1fae8adc79e1d8e687d25f",
    "artifacts": [
      {
        "path": "research/defects/sources/engine-v01-slow-update-excerpt.txt",
        "sha256": "0a5d3ab50791ead60d6e0dae31e23847bf75cb0d9d89d73025c7a094864bf990",
        "line_ranges": [
          "7",
          "10-82"
        ],
        "upstream_git_blob_sha": "53f9c81ac1acd37cb88b5b53d0d1428a2d5b7542",
        "original_path": "dynamics/engine.py",
        "original_line_ranges": [
          "374",
          "551-623"
        ]
      },
      {
        "path": "dynamics/reports/stress-v0.1.md",
        "sha256": "03f64b04a356d810c2d335a1ee733a143c9a751964a68ae28a1dc7b5e8b5e832",
        "line_ranges": [
          "130-161",
          "194",
          "215"
        ],
        "upstream_git_blob_sha": "9ff94cda35c980fcc233a77f4bd36b8674107578",
        "original_path": "dynamics/reports/stress-v0.1.md",
        "original_line_ranges": [
          "130-161",
          "194",
          "215"
        ]
      }
    ]
  },
  "artifact_status": "OBSERVED_FAILURE",
  "branch_status": "ADOPTED",
  "contemporaneous_record": {
    "observed_behavior": "Under higher input density, associative state changed once per processed event and rapidly saturated at the upper boundary.",
    "contemporaneous_diagnosis": "The v0.1 stress report identified event-density-dependent plastic update and noted that an actual tick- or episode-level update cadence was not implemented.",
    "historical_repair": "The associative, habit, and narrative coefficients were reduced and the report oracle was split into recovery-phase and post-recovery observations.",
    "observed_side_effect": "The coefficient reduction delayed saturation but did not separate event count from elapsed time, leaving the temporal mechanism unresolved."
  },
  "retrospective_interpretation": {
    "defect_classes": [
      "TEMPORAL_ALIASING"
    ],
    "candidate_principles": [
      {
        "principle_id": "HM-DYN-TEMPORAL-FLOW-JUMP",
        "statement": "Persistent change should distinguish elapsed-time flow from occurrence-triggered jumps.",
        "predicted_repairs": [
          "Separates idle recovery from event-driven plastic update",
          "Prevents transport-level event partitioning from multiplying a single semantic dose"
        ],
        "prohibited_legal_behavior": [
          "Genuine repeated exposure with distinct occurrence or reexposure identity may still accumulate",
          "Spacing may legitimately change the trajectory"
        ],
        "failure_condition": "After controlling semantic dose and timestamps, transport partition alone still changes persistent state beyond tolerance."
      }
    ],
    "competing_repairs": [
      "Apply a fixed per-tick plastic update budget without introducing continuous flow",
      "Update persistent state only at declared episode boundaries",
      "Use saturation-dependent learning rates while retaining event-count updates"
    ],
    "legal_control_cases": [
      "Thirty distinct exposures may produce more change than one exposure",
      "One past occurrence reaccessed now may produce current activation without rewriting the past occurrence time",
      "An idle interval may change recovery state while leaving evidence and world ledgers untouched"
    ],
    "minimal_counterexample": "Deliver one semantic occurrence as one message and as thirty transport fragments with identical occurrence identity, total dose, source, and timestamps; v0.1 updates slow state once per fragment.",
    "current_regression_tests": [],
    "empirical_status": "NOT_TESTED_ON_HUMANS"
  },
  "principle_value": {
    "independent_defects_addressed": [
      "Event-density-dependent plastic saturation",
      "Backlog age treated as if it were current event age"
    ],
    "discriminating_predictions": [
      "Burst and spaced exposure can diverge even when event count matches",
      "No-event elapsed time can change flow state but not append-only ledgers"
    ],
    "blocked_legal_controls": [],
    "added_degrees_of_freedom": [
      "Flow function",
      "Jump function",
      "Canonical time constants"
    ]
  }
}
